outcome,delta_vs_e95_lo_exclusive,delta_vs_e95_hi_inclusive,public_lb_lo_exclusive,public_lb_hi_inclusive,branch_status,allowed_next,candidate_to_test,forbidden,belief_update,top_attribution_focus,geometry_read,kill_claim,global_world_rate,global_mean_delta,subject_world_rate,subject_mean_delta,nearest_hard085_world_rate,nearest_hard085_mean_delta
breakthrough_win,-inf,-2e-05,-inf,0.5762713298,validated_large,"Promote E144, add it as a new anchor, rerun exact-delta branch audits before testing less-pruned variants.",,"Do not submit submission_e142_transferclip_09a92236.csv immediately; a big E144 win validates pruning first, not unpruned residual movement.","E142/E143 residual branch is public-real, but E149 still says this is branch geometry rather than a broad JEPA breakthrough.","global: component=inherited_e143_body, target=S4, target=Q3, target=Q1 | subject: component=inherited_e143_body, target=Q3, target=Q1, target=S4 | nearest_hard085: component=inherited_e143_body, target=Q1, target=S4, target=S2","E144 is near E143/E142 branch axes (cos_e143=0.991918719, cos_e142=0.952146833) and away from E101/E72 axes (cos_e101=-0.019625796, cos_e72=-0.024358970).",E144 public score is the smallest experiment that can validate or kill this branch-pruned residual world.,0.662544,-8.900183432417133e-05,0.497248,-7.198003525768785e-05,0.514704,-6.176511692266945e-05
clean_win,-2e-05,-7e-06,0.5762713298,0.5762843298,validated_readable,Promote E144 to frontier and rerun E142/E143/E144 audits with E144 as anchor.,,Do not relax the active/Q2S3 veto before a fresh exact-delta audit.,Fine active-boundary pruning is public-real at readable scale.,"global: target=S4, component=inherited_e143_body, component=e144_fine_tail_delta, target=Q1 | subject: component=inherited_e143_body, target=Q3, target=Q1, target=S4 | nearest_hard085: target=Q1, target=S4, component=inherited_e143_body, target=S2","E144 is near E143/E142 branch axes (cos_e143=0.991918719, cos_e142=0.952146833) and away from E101/E72 axes (cos_e101=-0.019625796, cos_e72=-0.024358970).",E144 public score is the smallest experiment that can validate or kill this branch-pruned residual world.,0.064664,-1.3440651872635823e-05,0.079392,-1.3397066054397651e-05,0.102048,-1.3220940075916822e-05
micro_win,-7e-06,-2e-06,0.5762843298,0.5762893298,validated_micro,"Promote E144, but spend the next experiment on an independent representation signal, not another same-family micro-tweak.",,Do not call this 0.54-path evidence or a broad representation breakthrough.,Branch-pruned residual geometry is alive but still frontier-scale small.,"global: target=S4, component=inherited_e143_body, component=e144_fine_tail_delta, target=S3 | subject: target=Q3, component=inherited_e143_body, target=Q1, target=S4 | nearest_hard085: target=Q1, target=S4, component=inherited_e143_body, target=S2","E144 is near E143/E142 branch axes (cos_e143=0.991918719, cos_e142=0.952146833) and away from E101/E72 axes (cos_e101=-0.019625796, cos_e72=-0.024358970).",E144 public score is the smallest experiment that can validate or kill this branch-pruned residual world.,0.018352,-4.5941824978175735e-06,0.02312,-4.547916302740889e-06,0.018864,-5.130814919455611e-06
tie,-2e-06,2e-06,0.5762893298,0.5762933297999999,ambiguous,Keep E95 as practical frontier; pause same-family submissions unless deliberately buying an information-only contrast.,,Do not auto-submit submission_e143_activeq2s3repair_68ca656f.csv; a tie is not evidence that E143 is better.,E144 did not resolve whether the branch is public-positive.,"global: target=S2, target=Q3, target=S3, target=Q1 | subject: target=S3, target=S2, component=e144_fine_tail_delta, target=S4 | nearest_hard085: target=S3, target=Q3, component=e144_fine_tail_delta, component=inherited_e143_body","E144 is near E143/E142 branch axes (cos_e143=0.991918719, cos_e142=0.952146833) and away from E101/E72 axes (cos_e101=-0.019625796, cos_e72=-0.024358970).",E144 public score is the smallest experiment that can validate or kill this branch-pruned residual world.,0.021772,-5.018837444033e-07,0.033068,-5.464296613642543e-07,0.047832,-3.297861136443301e-08
fine_loss_branch_alive,2e-06,9.036200000034356e-06,0.5762933297999999,0.576300366,conditional_alive,Do not auto-submit a follow-up. Use attribution: E143 is allowed only if the observed read points specifically to fine-tail/S3 retention rather than inherited-body/Q3/S2 or broad branch failure.,conditional:submission_e143_activeq2s3repair_68ca656f.csv,Do not submit submission_e143_activeq2s3repair_68ca656f.csv from score band alone; E148/E149 require target/component attribution first.,"E144 fine retained tail or a target-local slice may be too optimistic, but the scalar band alone does not identify the culprit.","global: target=S2, target=Q3, component=inherited_e143_body, target=Q1 | subject: component=inherited_e143_body, target=S3, target=S2, target=Q3 | nearest_hard085: target=S3, target=Q3, component=e144_fine_tail_delta, component=inherited_e143_body","E144 is near E143/E142 branch axes (cos_e143=0.991918719, cos_e142=0.952146833) and away from E101/E72 axes (cos_e101=-0.019625796, cos_e72=-0.024358970).",E144 public score is the smallest experiment that can validate or kill this branch-pruned residual world.,0.027696,5.606003224087781e-06,0.03334,5.799604899889505e-06,0.0317,4.918209371873573e-06
branch_loss,9.036200000034356e-06,1.5310700000048527e-05,0.576300366,0.5763066405,weak_rejected,Block E143/E142 automatic rescue. Re-audit why the branch underperformed the resolved E101 negative sensor.,,Do not rescue with submission_e143_activeq2s3repair_68ca656f.csv or submission_e142_transferclip_09a92236.csv before explaining E101 underperformance.,E101-conditioned transfer-budget branch is likely overfit as a selector.,"global: target=S2, component=inherited_e143_body, target=Q3, target=Q1 | subject: component=inherited_e143_body, target=S3, target=S2, target=Q3 | nearest_hard085: target=S3, target=Q3, component=inherited_e143_body, component=e144_fine_tail_delta","E144 is near E143/E142 branch axes (cos_e143=0.991918719, cos_e142=0.952146833) and away from E101/E72 axes (cos_e101=-0.019625796, cos_e72=-0.024358970).",E144 public score is the smallest experiment that can validate or kill this branch-pruned residual world.,0.023448,1.1561109396768311e-05,0.036668,1.145465750201688e-05,0.054456,1.209886001958766e-05
hard_fail,1.5310700000048527e-05,inf,0.5763066405,inf,rejected,Close E142/E143/E144 as public-sensor overfit and return to hidden representation search.,,"Do not tune top counts, keep factors, active/Q2S3 masks, or nearby same-family variants.",The transfer-budget residual branch failed as public-safe probability movement.,"global: component=inherited_e143_body, target=S2, target=Q3, target=Q1 | subject: component=inherited_e143_body, target=Q3, target=Q1, target=S3 | nearest_hard085: target=S3, component=inherited_e143_body, target=Q3, component=e144_fine_tail_delta","E144 is near E143/E142 branch axes (cos_e143=0.991918719, cos_e142=0.952146833) and away from E101/E72 axes (cos_e101=-0.019625796, cos_e72=-0.024358970).",E144 public score is the smallest experiment that can validate or kill this branch-pruned residual world.,0.181524,5.341091402036228e-05,0.297164,5.648050464146176e-05,0.230396,4.666220409800962e-05
