category,status,evidence,kill_condition
A_data_signal_shortage,evidence_weak_partial,"E142-E144 and blocktarget states still produce local/post101 signal; the issue is safe decoding, not absence of all signal.","If independent representation creates no local/post101 signal after E144, upgrade toward data-signal shortage."
B_validation_mismatch,evidence_strong,best known-LB selector p90 is 53.33x the E95 edge; E101 local optimism is 1.65x the E95 edge.,A new validation object must rank E95/E101/E144 correctly with error below 5e-6.
C_public_subset_mismatch,evidence_strong_but_underidentified,E101 public feedback invalidated broad-plausible local transfer while preserving part of mixmin gain; E144 requires score+attribution+geometry.,E144 clean win with attribution dominated by inherited body would reduce subset-mismatch emphasis.
D_target_prior_calibration_tail,evidence_strong,"E95 hardtail survives, E101 one-cell-scale S3 boundary misses, and E144 is mostly Q3/S3/S2/Q1/S4 tail calibration.",A broad all-target move beats E95 without hardtail pruning.
E_representation_decoder_problem,evidence_strong,"E137/E138 show state/safety visibility, but submit gates stay zero until E142-E144 hand-built decoder branch.","A representation-to-probability decoder passes strict, budget, post101 p95, and independent geometry without manual clipping."
F_candidate_selection_problem,mostly_rejected_for_existing_files,"E129 strict novel actionable count is 0; E144 branch count is 9 but cos(E144,E143)=0.991919.",A forgotten old candidate passes E129 plus E120/E149-style stress without being same-family.
