outcome,public_lb_lo_exclusive,public_lb_hi_inclusive,component_interpretation,next_component_probe,do_not_infer,s_group_expected_share,q_group_expected_share,between_train_runs_expected_share,q2_prob_abs_delta_share,q2_expected_share,s3_expected_share,s1_expected_share,top33_visible_support_p_low,q2_damping_focus_delta,q2_damping_visible_delta
q2_underopen_breakthrough,-inf,0.5762613298,"Credit broad S-stage/between-train-runs body first; Q2 damping is a secondary guard, not the whole explanation.",Decompose S3/S1/S4 body and then test Q2 amplitude only as a paired contrast.,Do not infer Q2-only causality from the scalar score.,0.6510979810948226,0.3489020189051772,0.8077722445852612,0.20970151191184608,0.12141592688211172,0.20351472514992014,0.18967909420596762,0.0146666666666666,8.234867891842881e-08,-1.906557451307581e-07
clean_win,0.5762613298,0.5762760190999999,Treat E176 as a broad-body anchor; the win supports Q/S asymmetry but does not prove Q2 keep=0.75 is optimal.,Run component responsibility audit before E174 or another sibling.,Do not infer Q2-only causality from the scalar score.,0.6510979810948226,0.3489020189051772,0.8077722445852612,0.20970151191184608,0.12141592688211172,0.20351472514992014,0.18967909420596762,0.0146666666666666,8.234867891842881e-08,-1.906557451307581e-07
micro_win,0.5762760190999999,0.5762883298,The sign is right but hard-label resolution is still thin; body and tail probably nearly cancel.,Only E174-vs-E176 is coherent if deliberately asking the Q2 amplitude question.,Do not infer Q2-only causality from the scalar score.,0.6510979810948226,0.3489020189051772,0.8077722445852612,0.20970151191184608,0.12141592688211172,0.20351472514992014,0.18967909420596762,0.0146666666666666,8.234867891842881e-08,-1.906557451307581e-07
tie,0.5762883298,0.5762943298,The broad body exists but top critical cells are underresolved; the top33 visible support p_low is the warning.,Use E172 only as same-family safety; no Q2 keep sweep.,Do not infer Q2-only causality from the scalar score.,0.6510979810948226,0.3489020189051772,0.8077722445852612,0.20970151191184608,0.12141592688211172,0.20351472514992014,0.18967909420596762,0.0146666666666666,8.234867891842881e-08,-1.906557451307581e-07
small_loss,0.5762943298,0.576300366,"Read as tail/cancellation failure, not as proof that Q2 alone is wrong.",E172 if testing same-family safety; otherwise E154.,Do not infer Q2-only causality from the scalar score.,0.6510979810948226,0.3489020189051772,0.8077722445852612,0.20970151191184608,0.12141592688211172,0.20351472514992014,0.18967909420596762,0.0146666666666666,8.234867891842881e-08,-1.906557451307581e-07
e101_worse_mixmin_safe,0.576300366,0.5763066405,Partial-reopen is public-misaligned despite Q2 damping.,Demote E176/E174; prefer E154 repaired-branch counter-world.,Do not infer Q2-only causality from the scalar score.,0.6510979810948226,0.3489020189051772,0.8077722445852612,0.20970151191184608,0.12141592688211172,0.20351472514992014,0.18967909420596762,0.0146666666666666,8.234867891842881e-08,-1.906557451307581e-07
branch_loss,0.5763066405,0.5763413298,The broad partial-reopen body gives back the frontier edge.,Close same-family expected-score followups and use E154/search.,Do not infer Q2-only causality from the scalar score.,0.6510979810948226,0.3489020189051772,0.8077722445852612,0.20970151191184608,0.12141592688211172,0.20351472514992014,0.18967909420596762,0.0146666666666666,8.234867891842881e-08,-1.906557451307581e-07
hard_fail,0.5763413298,inf,Dominant negative axis is outside this component family.,Return to non-collinear latent/hidden-block search.,Do not infer Q2-only causality from the scalar score.,0.6510979810948226,0.3489020189051772,0.8077722445852612,0.20970151191184608,0.12141592688211172,0.20351472514992014,0.18967909420596762,0.0146666666666666,8.234867891842881e-08,-1.906557451307581e-07
